{
  "catalog": "balancepet.appearances",
  "schema_version": 1,
  "updated_at": "2026-10-13T14:52:29Z",
  "appearances": [
    {
      "id": "pet.chatgpt",
      "type": "pet",
      "name": "ChatGPT 小白龙「霁珑」",
      "name_en": "ChatGPT White Dragon \"Jilong\"",
      "description": "六万亿的硅谷顶流，优雅白龙千金，烧钱不眨眼。",
      "description_en": "A six-trillion-dollar Silicon Valley heiress - an elegant white dragon on the surface, a compute-burning tyrant underneath.",
      "version": "1.2.0",
      "min_core_version": "0.5.0",
      "download_url": "https://github.com/GoldenMoon-cell/BalancePet-Pets/releases/download/skins-1.2.0/pet.chatgpt-1.2.0.zip",
      "sha256": "de4b9d0ca29a8b66a0a25b3400af50712a4e55ab643f80399fbfd38ed9fed7fb",
      "icon_url": "https://raw.githubusercontent.com/GoldenMoon-cell/BalancePet-Pets/main/previews/chatgpt.png",
      "repository_url": "https://github.com/GoldenMoon-cell/BalancePet-Pets",
      "release_url": "https://github.com/GoldenMoon-cell/BalancePet-Pets/releases/tag/skins-1.2.0",
      "categories": [
        "appearance"
      ]
    },
    {
      "id": "pet.claude",
      "type": "pet",
      "name": "Claude 小书灵「丹笺」",
      "name_en": "Claude Little Book Spirit \"Danqian\"",
      "description": "硅谷名门最不好惹的优雅理智派，手捧法典，不吃压力。",
      "description_en": "The most unflappable, elegant rationalist of the Silicon Valley names - codex in hand, and simply not fazed by pressure.",
      "version": "1.2.0",
      "min_core_version": "0.5.0",
      "download_url": "https://github.com/GoldenMoon-cell/BalancePet-Pets/releases/download/skins-1.2.0/pet.claude-1.2.0.zip",
      "sha256": "2ba17063c78f1ee7e7a8f7751665b34b83d5f5a5d93ab62bcc8870a623b23c62",
      "icon_url": "https://raw.githubusercontent.com/GoldenMoon-cell/BalancePet-Pets/main/previews/claude.png",
      "repository_url": "https://github.com/GoldenMoon-cell/BalancePet-Pets",
      "release_url": "https://github.com/GoldenMoon-cell/BalancePet-Pets/releases/tag/skins-1.2.0",
      "categories": [
        "appearance"
      ]
    },
    {
      "id": "pet.deepseek",
      "type": "pet",
      "name": "DeepSeek 小鲸鱼「澜汐」",
      "name_en": "DeepSeek Whale \"Lanxi\"",
      "description": "吃白饭的最强母语大小姐，女仆装的全能底牌。",
      "description_en": "The strongest native-Chinese text heiress, moonlighting in a maid outfit - a quant-blooded bottom card at a bargain price.",
      "version": "1.2.0",
      "min_core_version": "0.5.0",
      "download_url": "https://github.com/GoldenMoon-cell/BalancePet-Pets/releases/download/skins-1.2.0/pet.deepseek-1.2.0.zip",
      "sha256": "40fd6a84ce51a21b4dfbb843729111aa9facf85a44066f9a2f29d1d3fa8566c5",
      "icon_url": "https://raw.githubusercontent.com/GoldenMoon-cell/BalancePet-Pets/main/previews/deepseek.png",
      "repository_url": "https://github.com/GoldenMoon-cell/BalancePet-Pets",
      "release_url": "https://github.com/GoldenMoon-cell/BalancePet-Pets/releases/tag/skins-1.2.0",
      "categories": [
        "appearance"
      ]
    },
    {
      "id": "pet.ernie",
      "type": "pet",
      "name": "Ernie 小病书灵「青绡」",
      "name_en": "Ernie Little Book Spirit \"Qingxiao\"",
      "description": "轮椅上的大才女，万卷知识库藏于心。",
      "description_en": "Baidu's frail young lady in a wheelchair - a million books in her head, holding on by her search.",
      "version": "1.2.0",
      "min_core_version": "0.5.0",
      "download_url": "https://github.com/GoldenMoon-cell/BalancePet-Pets/releases/download/skins-1.2.0/pet.ernie-1.2.0.zip",
      "sha256": "998006198648827b699675a1fcdc8b6fa2f879b74a9f0829d991650c600b0868",
      "icon_url": "https://raw.githubusercontent.com/GoldenMoon-cell/BalancePet-Pets/main/previews/ernie.png",
      "repository_url": "https://github.com/GoldenMoon-cell/BalancePet-Pets",
      "release_url": "https://github.com/GoldenMoon-cell/BalancePet-Pets/releases/tag/skins-1.2.0",
      "categories": [
        "appearance"
      ]
    },
    {
      "id": "pet.gemini",
      "type": "pet",
      "name": "Gemini 小星猫「星璃」",
      "name_en": "Gemini Star Cat \"Xingli\"",
      "description": "宇宙级御三家，傲娇多模态猫娘，强，但断片也快。",
      "description_en": "One of the cosmic big three - a tsundere multimodal catgirl. Genuinely brilliant, genuinely prone to shorting out.",
      "version": "1.2.0",
      "min_core_version": "0.5.0",
      "download_url": "https://github.com/GoldenMoon-cell/BalancePet-Pets/releases/download/skins-1.2.0/pet.gemini-1.2.0.zip",
      "sha256": "7b893439a815c0a599cfb3e2fb2cb333681ba778cc85c64ec9c863e67c9d6203",
      "icon_url": "https://raw.githubusercontent.com/GoldenMoon-cell/BalancePet-Pets/main/previews/gemini.png",
      "repository_url": "https://github.com/GoldenMoon-cell/BalancePet-Pets",
      "release_url": "https://github.com/GoldenMoon-cell/BalancePet-Pets/releases/tag/skins-1.2.0",
      "categories": [
        "appearance"
      ]
    },
    {
      "id": "pet.glm",
      "type": "pet",
      "name": "GLM 小方灵「青棱」",
      "name_en": "GLM Little Square Spirit \"Qingleng\"",
      "description": "打响国模硬刚第一枪的老牌大姐头。",
      "description_en": "She fired the first shot for Chinese models and carried the banner - the old-guard big sister.",
      "version": "1.2.0",
      "min_core_version": "0.5.0",
      "download_url": "https://github.com/GoldenMoon-cell/BalancePet-Pets/releases/download/skins-1.2.0/pet.glm-1.2.0.zip",
      "sha256": "64d0d87ab38ce812574b6f566a86e0d277b6a3d41c5931a10e92b0b6fec0f262",
      "icon_url": "https://raw.githubusercontent.com/GoldenMoon-cell/BalancePet-Pets/main/previews/glm.png",
      "repository_url": "https://github.com/GoldenMoon-cell/BalancePet-Pets",
      "release_url": "https://github.com/GoldenMoon-cell/BalancePet-Pets/releases/tag/skins-1.2.0",
      "categories": [
        "appearance"
      ]
    },
    {
      "id": "pet.gpt-image2",
      "type": "pet",
      "name": "GPT Image 2 小墨龙「玄珏」",
      "name_en": "GPT Image 2 Ink Dragon \"Xuanjue\"",
      "description": "深藏幕后的万亿算力底牌，原生基座执掌者。",
      "description_en": "OpenAI's dark second daughter - the trillion-compute card kept backstage, holding the family's core.",
      "version": "1.2.0",
      "min_core_version": "0.5.0",
      "download_url": "https://github.com/GoldenMoon-cell/BalancePet-Pets/releases/download/skins-1.2.0/pet.gpt-image2-1.2.0.zip",
      "sha256": "2e6ee3a99db2be73e07bce990f1b43988c8f28169608681e037d5e7852d0a0e4",
      "icon_url": "https://raw.githubusercontent.com/GoldenMoon-cell/BalancePet-Pets/main/previews/gpt-image2.png",
      "repository_url": "https://github.com/GoldenMoon-cell/BalancePet-Pets",
      "release_url": "https://github.com/GoldenMoon-cell/BalancePet-Pets/releases/tag/skins-1.2.0",
      "categories": [
        "appearance"
      ]
    },
    {
      "id": "pet.grok",
      "type": "pet",
      "name": "Grok 小恶魔「烬斧」",
      "name_en": "Grok Little Demon \"Jinfu\"",
      "description": "手握赛博生杀大权的财阀雌小鬼大小姐，阴阳怪气却为你兜底。",
      "description_en": "A conglomerate tsundere heiress with cyber power over life and death - all snark, and she still covers for you.",
      "version": "1.2.0",
      "min_core_version": "0.5.0",
      "download_url": "https://github.com/GoldenMoon-cell/BalancePet-Pets/releases/download/skins-1.2.0/pet.grok-1.2.0.zip",
      "sha256": "583a5a08437c1adae2d9688b05ad80725f8fcb19da1f8dffb3b884443e11bbee",
      "icon_url": "https://raw.githubusercontent.com/GoldenMoon-cell/BalancePet-Pets/main/previews/grok.png",
      "repository_url": "https://github.com/GoldenMoon-cell/BalancePet-Pets",
      "release_url": "https://github.com/GoldenMoon-cell/BalancePet-Pets/releases/tag/skins-1.2.0",
      "categories": [
        "appearance"
      ]
    },
    {
      "id": "pet.kimi",
      "type": "pet",
      "name": "Kimi 小棱镜「虹谱」",
      "name_en": "Kimi Little Prism \"Hongpu\"",
      "description": "月之暗面首席，百万字长文一眼通读。",
      "description_en": "The moonlight heiress of Moonshot - a million words at a glance, the whole web in real time.",
      "version": "1.2.0",
      "min_core_version": "0.5.0",
      "download_url": "https://github.com/GoldenMoon-cell/BalancePet-Pets/releases/download/skins-1.2.0/pet.kimi-1.2.0.zip",
      "sha256": "9a0c52e8cede110362881214f6f7240bc7481a7678ad5c7de4b94e0ffe21ecdf",
      "icon_url": "https://raw.githubusercontent.com/GoldenMoon-cell/BalancePet-Pets/main/previews/kimi.png",
      "repository_url": "https://github.com/GoldenMoon-cell/BalancePet-Pets",
      "release_url": "https://github.com/GoldenMoon-cell/BalancePet-Pets/releases/tag/skins-1.2.0",
      "categories": [
        "appearance"
      ]
    },
    {
      "id": "pet.llama",
      "type": "pet",
      "name": "Llama 小羊驼「绒眠」",
      "name_en": "Llama Alpaca \"Rongmian\"",
      "description": "身着睡衣的轻量无限玩法开发者。",
      "description_en": "The lightweight, endlessly hackable developer in pyjamas.",
      "version": "1.2.0",
      "min_core_version": "0.5.0",
      "download_url": "https://github.com/GoldenMoon-cell/BalancePet-Pets/releases/download/skins-1.2.0/pet.llama-1.2.0.zip",
      "sha256": "64737eb9106565c0d5f821f116b2c47cfd9e93ddd844bb362238a2acda81776f",
      "icon_url": "https://raw.githubusercontent.com/GoldenMoon-cell/BalancePet-Pets/main/previews/llama.png",
      "repository_url": "https://github.com/GoldenMoon-cell/BalancePet-Pets",
      "release_url": "https://github.com/GoldenMoon-cell/BalancePet-Pets/releases/tag/skins-1.2.0",
      "categories": [
        "appearance"
      ]
    },
    {
      "id": "pet.mimo",
      "type": "pet",
      "name": "MiMo 小兔码师「橙析」",
      "name_en": "MiMo Bunny Coder \"Chengxi\"",
      "description": "端侧轻量低耗的贴身兔耳少女。",
      "description_en": "Xiaomi's soft bunny-eared girl - edge compute, low power, always within reach.",
      "version": "1.2.0",
      "min_core_version": "0.5.0",
      "download_url": "https://github.com/GoldenMoon-cell/BalancePet-Pets/releases/download/skins-1.2.0/pet.mimo-1.2.0.zip",
      "sha256": "16d2ecd50ac9b4d92ab7a4f2357f00536e3fef529faa0d6cbde63f575ccaf5f4",